{
  "$schema": "http://json-schema.org/draft-07/schema#",
  "title": "Little Snitch Remotes",
  "description": "Remote destinations for coding agents",
  "type": "object",
  "properties": {
    "description": { "type": "string" },
    "domains": { 
      "type": "array",
      "items": { "type": "string" }
    },
    "hosts": { 
      "type": "array", 
      "items": { "type": "string" } 
    },
    "notes": { "type": "string" },
    "lastUpdated": { "type": "string" }
  },
  "required": ["domains"]
}
