{
  "description": "Remote destinations for coding agents",
  "domains": [
    "agentclientprotocol.com",
    "ahrefs.com",
    "anthropic.com",
    "antigravity.google",
    "auth0.com",
    "azure.com",
    "azureml.ms",
    "brew.sh",
    "chatgpt.com",
    "claude.ai",
    "claude.com",
    "claudemcpcontent.com",
    "claudeusercontent.com",
    "codeium.com",
    "codeiumdata.com",
    "cursor-cdn.com",
    "cursor.com",
    "cursor.sh",
    "cursorapi.com",
    "cursorvm.com",
    "datadoghq.com",
    "deepwiki.com",
    "devin.ai",
    "eclipsecontent.org",
    "esm.sh",
    "exp-tas.com",
    "facebook.com",
    "figma.com",
    "github.com",
    "github.io",
    "githubassets.com",
    "githubcopilot.com",
    "githubusercontent.com",
    "google.com",
    "googleapis.com",
    "granola.ai",
    "gstatic.com",
    "gvt1.com",
    "hcaptcha.com",
    "huggingface.co",
    "idiolect.app",
    "influxdata.com",
    "iojs.org",
    "js.org",
    "kiro.dev",
    "launchpadcontent.net",
    "letsbot.net",
    "linear.app",
    "locofy.ai",
    "meta.ai",
    "microsoft.com",
    "nodejs.org",
    "nodesource.com",
    "notion.so",
    "npmjs.org",
    "oaistatic.com",
    "oaistatsig.com",
    "oaiusercontent.com",
    "open-vsx.org",
    "openai.com",
    "opencode.ai",
    "openrouter.ai",
    "playwright.dev",
    "run.app",
    "rust-lang.org",
    "rustup.rs",
    "sentry.io",
    "slack.com",
    "slack.dev",
    "snapcraft.io",
    "snapcraftcontent.com",
    "sqlite.org",
    "stripe.com",
    "stripe.network",
    "trafficmanager.net",
    "ubuntu.com",
    "vercel-storage.com",
    "visualstudio.com",
    "vscode-cdn.net",
    "windows.net",
    "windsurf.com",
    "yarnpkg.com"
  ],
  "hosts": [],
  "notes": "Extracted from Little Snitch rule export - real coding agent connections with actual app paths",
  "lastUpdated": "2026-08-27"
}